{
  "schema": "matrix.keymaker.protocol_manifest.v1",
  "protocol_id": "lock-rigid-rotor-spectrum.v1",
  "manifest_version": "1.0.0",
  "status": "approved",
  "owner_operation": "rovib",
  "entrypoint": "KEYMAKER",
  "title": "Simulate and render the native LOCK rigid-rotor spectrum",
  "summary": "Simulate and render the native LOCK rigid-rotor spectrum. The contract registers the existing owner API and does not certify the accuracy of a particular molecular calculation.",
  "calculation_protocol": "spectroscopy.rotational.v1",
  "aliases": [],
  "dependencies": [],
  "routes": [
    {
      "menu": "prediction_assignment",
      "action": "rovib.wmsrot_simulate_and_render",
      "option_equals": {}
    }
  ],
  "inputs": [
    {
      "name": "owner_inputs",
      "schema": "oracle.xyz.rotational.v1",
      "required": true
    }
  ],
  "outputs": [
    {
      "name": "owner_result",
      "schema": "oracle.xyz.rotational_spectrum.v1",
      "required": true
    }
  ],
  "gates": [
    "Use the native LOCK engine and explicit Watson reduction and J limits",
    "Record dipole components, temperature and line frequency units"
  ],
  "implementation": {
    "owner_api": "matrix_rovib.wmsrot",
    "action": "write_lock_rotor_spectrum_outputs"
  },
  "coordinate_policy": "Preserve the ordered molecular identity, isotope masses, coordinate frame and declared owner representation; no geometry remapping or method substitution is implicit.",
  "backend_policy": "The scientific owner validates the inputs and numerical controls. Any missing electronic-structure acquisition uses the separately authorized calculation gateway; registration alone launches nothing.",
  "change_policy": "new_version_and_explicit_approval"
}
