{
  "schema": "matrix.keymaker.protocol_manifest.v1",
  "manifest_version": "1.0.0",
  "status": "approved",
  "entrypoint": "KEYMAKER",
  "aliases": [],
  "change_policy": "new_version_and_explicit_approval",
  "protocol_id": "oracle-perception.v1",
  "owner_operation": "oracle",
  "title": "ORACLE molecular perception",
  "summary": "Perceive topology and freeze the primitive-coordinate source from a mapped geometry seed.",
  "calculation_protocol": "perception.oracle.v1",
  "dependencies": [
    "switch-source-normalization.v1"
  ],
  "routes": [
    {
      "menu": "perception",
      "action": "oracle.perceive",
      "option_equals": {}
    }
  ],
  "inputs": [
    {
      "name": "geometry_seed",
      "schema": "matrix.geometry.seed.v1",
      "required": true
    }
  ],
  "outputs": [
    {
      "name": "oracle_contract",
      "schema": "matrix.oracle.contract.v1",
      "required": true
    },
    {
      "name": "oracle_state",
      "schema": "matrix.oracle.enriched_xyzin.v1",
      "required": true
    },
    {
      "name": "sonic_contract",
      "schema": "oracle.sonic.contract.v2",
      "required": true
    }
  ],
  "gates": [
    "atom-map preservation",
    "topology and primitive fingerprint",
    "complete symmetry contract"
  ],
  "implementation": {
    "owner_api": "matrix_oracle.keymaker_handoff",
    "action": "analyze_and_freeze"
  },
  "coordinate_policy": "ORACLE owns topology, primitives and the Wilson B source.",
  "backend_policy": "Resident ORACLE perception."
}
