{
  "schema": "matrix.keymaker.protocol_manifest.v1",
  "protocol_id": "dvr-tunneling.v1",
  "manifest_version": "1.0.0",
  "status": "approved",
  "owner_operation": "dvr",
  "entrypoint": "KEYMAKER",
  "title": "Solve the declared DVR tunneling request",
  "summary": "Solve the declared DVR tunneling request. The contract registers the existing owner API and does not certify the accuracy of a particular molecular calculation.",
  "calculation_protocol": "spectroscopy.variational.v1",
  "aliases": [],
  "dependencies": [],
  "routes": [
    {
      "menu": "exploitation",
      "action": "tunneling",
      "option_equals": {}
    }
  ],
  "inputs": [
    {
      "name": "owner_inputs",
      "schema": "matrix.tunneling.request.v1",
      "required": true
    }
  ],
  "outputs": [
    {
      "name": "owner_result",
      "schema": "matrix.tunneling.result.v1",
      "required": true
    }
  ],
  "gates": [
    "Validate the versioned request, solver and boundary conditions",
    "Retain declared levels, workers and output provenance"
  ],
  "implementation": {
    "owner_api": "matrix_dvr.tunneling",
    "action": "run_tunneling_request"
  },
  "coordinate_policy": "Preserve the ordered molecular identity, isotope masses, coordinate frame and declared owner representation; no geometry remapping or method substitution is implicit.",
  "backend_policy": "The scientific owner validates the inputs and numerical controls. Any missing electronic-structure acquisition uses the separately authorized calculation gateway; registration alone launches nothing.",
  "change_policy": "new_version_and_explicit_approval"
}
